{
  "$schema": "./2x-branch-point.schema.json",
  "schema_version": "1.0",
  "record_type": "qiongli-2x-branch-point",
  "branch": "2.x",
  "source": {
    "branch": "dev",
    "baseline_commit": "70c5bd9e5b098fbb61bd60934e8774b2eef44a01",
    "baseline_tree": "c17f7612cdd6e69040332442fde7e6d44c0c24a0",
    "initialization_commit": "974f3f254040aad064f06cce6b75fc4a9c950456",
    "initialization_tree": "c17f7612cdd6e69040332442fde7e6d44c0c24a0",
    "initialization_tree_changed": false,
    "accepted_release_tag": "v1.19.0-beta.1",
    "accepted_release_commit": "8d2e99866ce4c4efb8b3b5e0265c0c1f89a36b0f",
    "maintenance_branch": "release/1.x-python"
  },
  "baseline": {
    "manifest_path": "tooling/migration/baselines/v1.19.0-beta.1/manifest.json",
    "manifest_sha256": "77bb7628d43a496c995e4b0a8daf6a624847b62e96948c0461affe89002da131",
    "corpus_sha256": "7fdd92894d88b221180e77ad73677cc158147cc861b17ba0245ea54f0127fbe2"
  },
  "source_validation": {
    "ci": {
      "run_id": 29141373649,
      "head_sha": "70c5bd9e5b098fbb61bd60934e8774b2eef44a01",
      "job_count": 5,
      "conclusion": "success",
      "url": "https://github.com/jxpeng98/qiongli/actions/runs/29141373649"
    },
    "checkout_install_check": {
      "run_id": 29141373644,
      "head_sha": "70c5bd9e5b098fbb61bd60934e8774b2eef44a01",
      "job_count": 3,
      "conclusion": "success",
      "url": "https://github.com/jxpeng98/qiongli/actions/runs/29141373644"
    }
  },
  "branch_validation": {
    "record_commit": "69855fd50413ee6809baf21eb345fc0c55721de3",
    "ci": {
      "run_id": 29142556037,
      "head_sha": "69855fd50413ee6809baf21eb345fc0c55721de3",
      "job_count": 5,
      "conclusion": "success",
      "url": "https://github.com/jxpeng98/qiongli/actions/runs/29142556037"
    },
    "checkout_install_check": {
      "run_id": 29142556048,
      "head_sha": "69855fd50413ee6809baf21eb345fc0c55721de3",
      "job_count": 3,
      "conclusion": "success",
      "url": "https://github.com/jxpeng98/qiongli/actions/runs/29142556048"
    }
  },
  "protection": {
    "development_handoff_policy": {
      "applies_to": ["dev", "2.x"],
      "pull_request_required": true,
      "dismiss_stale_reviews": true,
      "required_review_thread_resolution": true,
      "required_checks_strict": true,
      "required_check_count": 8,
      "deletion_blocked": true,
      "non_fast_forward_blocked": true,
      "bypass_actors": [],
      "current_user_can_bypass": "never"
    },
    "dev": {
      "ruleset_id": 17189053,
      "name": "dev protected 1.x handoff",
      "enforcement": "active",
      "url": "https://github.com/jxpeng98/qiongli/rules/17189053"
    },
    "native_development": {
      "branch": "2.x",
      "ruleset_id": 18800504,
      "name": "2.x protected native development",
      "enforcement": "active",
      "url": "https://github.com/jxpeng98/qiongli/rules/18800504"
    },
    "maintenance": {
      "branch": "release/1.x-python",
      "ruleset_id": 18797579,
      "name": "release/1.x-python critical-fix-only",
      "enforcement": "active",
      "url": "https://github.com/jxpeng98/qiongli/rules/18797579"
    }
  },
  "branch_validation_policy": {
    "required_workflows": [
      "CI",
      "Checkout Install Check"
    ],
    "evidence_binding": "GitHub Actions checks on the commit introducing this record",
    "ruleset_activation_gate": "Both branch-specific workflows pass before active protection"
  }
}
